{
  "$schema": "https://json-schema.org/draft/2020-12/schema",
  "$id": "https://jong-support.example/schemas/tournament-archive.schema.json",
  "title": "Jong Support Tournament Archive",
  "type": "object",
  "additionalProperties": false,
  "required": [
    "schemaVersion",
    "exportedAt",
    "tournament",
    "players",
    "mahjong",
    "subgame",
    "exportMetadata"
  ],
  "properties": {
    "schemaVersion": {
      "const": "1.0.0"
    },
    "exportedAt": {
      "type": "string",
      "pattern": "^\\d{4}-\\d{2}-\\d{2}T\\d{2}:\\d{2}:\\d{2}Z$"
    },
    "tournament": {
      "$ref": "#/$defs/tournament"
    },
    "players": {
      "type": "array",
      "minItems": 1,
      "items": {
        "$ref": "#/$defs/player"
      }
    },
    "mahjong": {
      "$ref": "#/$defs/mahjongDepartment"
    },
    "subgame": {
      "oneOf": [
        {
          "$ref": "#/$defs/subgameDepartment"
        },
        {
          "type": "null"
        }
      ]
    },
    "exportMetadata": {
      "$ref": "#/$defs/exportMetadata"
    }
  },
  "$defs": {
    "identifier": {
      "type": "string",
      "minLength": 1,
      "maxLength": 100,
      "pattern": "^[A-Za-z0-9][A-Za-z0-9._-]*$"
    },
    "playerId": {
      "type": "string",
      "pattern": "^player_[0-9a-f]{32}$"
    },
    "positiveInteger": {
      "type": "integer",
      "minimum": 1
    },
    "finiteNumber": {
      "type": "number"
    },
    "tournament": {
      "type": "object",
      "additionalProperties": false,
      "required": ["id", "name", "date", "revision"],
      "properties": {
        "id": {
          "$ref": "#/$defs/identifier"
        },
        "name": {
          "type": "string",
          "minLength": 1,
          "maxLength": 200
        },
        "date": {
          "type": "string",
          "pattern": "^\\d{4}-\\d{2}-\\d{2}$"
        },
        "revision": {
          "$ref": "#/$defs/positiveInteger"
        }
      }
    },
    "rankingEligibility": {
      "type": "string",
      "enum": ["official", "reference", "notParticipating"]
    },
    "player": {
      "type": "object",
      "additionalProperties": false,
      "required": ["playerId", "nickname", "rankingEligibility"],
      "properties": {
        "playerId": {
          "$ref": "#/$defs/playerId"
        },
        "nickname": {
          "type": "string",
          "minLength": 1,
          "maxLength": 100
        },
        "rankingEligibility": {
          "type": "object",
          "additionalProperties": false,
          "required": ["mahjong", "subgame"],
          "properties": {
            "mahjong": {
              "$ref": "#/$defs/rankingEligibility"
            },
            "subgame": {
              "$ref": "#/$defs/rankingEligibility"
            }
          }
        }
      }
    },
    "scoringRuleReference": {
      "oneOf": [
        {
          "type": "object",
          "additionalProperties": false,
          "required": ["ruleId", "ruleVersion", "parameters"],
          "properties": {
            "ruleId": {
              "const": "stored-final-points"
            },
            "ruleVersion": {
              "const": "1.0.0"
            },
            "parameters": {
              "type": "object",
              "additionalProperties": false
            }
          }
        }
      ]
    },
    "gameResult": {
      "type": "object",
      "additionalProperties": false,
      "required": ["playerId", "rawScore", "rank", "finalPoint"],
      "properties": {
        "playerId": {
          "$ref": "#/$defs/playerId"
        },
        "rawScore": {
          "$ref": "#/$defs/finiteNumber"
        },
        "rank": {
          "type": "integer",
          "minimum": 1,
          "maximum": 4
        },
        "finalPoint": {
          "$ref": "#/$defs/finiteNumber"
        }
      }
    },
    "mahjongGame": {
      "type": "object",
      "additionalProperties": false,
      "required": ["gameId", "roundNumber", "tableNumber", "results"],
      "properties": {
        "gameId": {
          "$ref": "#/$defs/identifier"
        },
        "roundNumber": {
          "$ref": "#/$defs/positiveInteger"
        },
        "tableNumber": {
          "$ref": "#/$defs/positiveInteger"
        },
        "results": {
          "type": "array",
          "minItems": 4,
          "maxItems": 4,
          "items": {
            "$ref": "#/$defs/gameResult"
          }
        }
      }
    },
    "officialResult": {
      "type": "object",
      "additionalProperties": false,
      "required": ["playerId", "point", "rank"],
      "properties": {
        "playerId": {
          "$ref": "#/$defs/playerId"
        },
        "point": {
          "$ref": "#/$defs/finiteNumber"
        },
        "rank": {
          "$ref": "#/$defs/positiveInteger"
        }
      }
    },
    "mahjongDepartment": {
      "type": "object",
      "additionalProperties": false,
      "required": ["scoring", "games", "officialResults"],
      "properties": {
        "scoring": {
          "$ref": "#/$defs/scoringRuleReference"
        },
        "games": {
          "type": "array",
          "items": {
            "$ref": "#/$defs/mahjongGame"
          }
        },
        "officialResults": {
          "type": "array",
          "items": {
            "$ref": "#/$defs/officialResult"
          }
        }
      }
    },
    "subgameResult": {
      "type": "object",
      "additionalProperties": false,
      "required": ["roundNumber", "playerId", "point"],
      "properties": {
        "roundNumber": {
          "$ref": "#/$defs/positiveInteger"
        },
        "playerId": {
          "$ref": "#/$defs/playerId"
        },
        "point": {
          "$ref": "#/$defs/finiteNumber"
        }
      }
    },
    "subgameDepartment": {
      "type": "object",
      "additionalProperties": false,
      "required": ["dataStatus", "scoring", "results", "officialResults"],
      "properties": {
        "dataStatus": {
          "type": "string",
          "enum": ["sample", "official"]
        },
        "scoring": {
          "$ref": "#/$defs/scoringRuleReference"
        },
        "results": {
          "type": "array",
          "items": {
            "$ref": "#/$defs/subgameResult"
          }
        },
        "officialResults": {
          "type": "array",
          "items": {
            "$ref": "#/$defs/officialResult"
          }
        }
      }
    },
    "exportMetadata": {
      "type": "object",
      "additionalProperties": false,
      "required": ["generator", "source"],
      "properties": {
        "generator": {
          "type": "string",
          "minLength": 1,
          "maxLength": 100
        },
        "source": {
          "type": "string",
          "enum": ["sample", "manual", "import"]
        }
      }
    }
  }
}
