{
  "schemaVersion": "1.0.0",
  "exportedAt": "2026-07-01T12:00:00Z",
  "tournament": {
    "id": "2026-sample",
    "name": "2026年度大会（匿名化サンプル）",
    "date": "2026-07-01",
    "revision": 1
  },
  "players": [
    {
      "playerId": "player_00000000000000000000000000000001",
      "nickname": "Player A",
      "rankingEligibility": { "mahjong": "official", "subgame": "official" }
    },
    {
      "playerId": "player_00000000000000000000000000000002",
      "nickname": "Player B",
      "rankingEligibility": { "mahjong": "official", "subgame": "official" }
    },
    {
      "playerId": "player_00000000000000000000000000000003",
      "nickname": "Player C",
      "rankingEligibility": { "mahjong": "official", "subgame": "official" }
    },
    {
      "playerId": "player_00000000000000000000000000000004",
      "nickname": "Player D",
      "rankingEligibility": { "mahjong": "official", "subgame": "official" }
    },
    {
      "playerId": "player_00000000000000000000000000000005",
      "nickname": "Player E",
      "rankingEligibility": { "mahjong": "official", "subgame": "official" }
    },
    {
      "playerId": "player_00000000000000000000000000000006",
      "nickname": "Player F",
      "rankingEligibility": { "mahjong": "official", "subgame": "official" }
    },
    {
      "playerId": "player_00000000000000000000000000000007",
      "nickname": "Player G",
      "rankingEligibility": { "mahjong": "official", "subgame": "official" }
    },
    {
      "playerId": "player_00000000000000000000000000000008",
      "nickname": "Player H",
      "rankingEligibility": { "mahjong": "reference", "subgame": "official" }
    }
  ],
  "mahjong": {
    "scoring": {
      "ruleId": "stored-final-points",
      "ruleVersion": "1.0.0",
      "parameters": {}
    },
    "games": [
      {
        "gameId": "R01-T01",
        "roundNumber": 1,
        "tableNumber": 1,
        "results": [
          { "playerId": "player_00000000000000000000000000000001", "rawScore": 40000, "rank": 1, "finalPoint": 30 },
          { "playerId": "player_00000000000000000000000000000002", "rawScore": 30000, "rank": 2, "finalPoint": 10 },
          { "playerId": "player_00000000000000000000000000000003", "rawScore": 20000, "rank": 3, "finalPoint": -10 },
          { "playerId": "player_00000000000000000000000000000008", "rawScore": 10000, "rank": 4, "finalPoint": -30 }
        ]
      },
      {
        "gameId": "R01-T02",
        "roundNumber": 1,
        "tableNumber": 2,
        "results": [
          { "playerId": "player_00000000000000000000000000000004", "rawScore": 50000, "rank": 1, "finalPoint": 40 },
          { "playerId": "player_00000000000000000000000000000005", "rawScore": 25000, "rank": 2, "finalPoint": 0 },
          { "playerId": "player_00000000000000000000000000000006", "rawScore": 15000, "rank": 3, "finalPoint": -15 },
          { "playerId": "player_00000000000000000000000000000007", "rawScore": 10000, "rank": 4, "finalPoint": -25 }
        ]
      },
      {
        "gameId": "R02-T01",
        "roundNumber": 2,
        "tableNumber": 1,
        "results": [
          { "playerId": "player_00000000000000000000000000000002", "rawScore": 45000, "rank": 1, "finalPoint": 35 },
          { "playerId": "player_00000000000000000000000000000003", "rawScore": 25000, "rank": 2, "finalPoint": 5 },
          { "playerId": "player_00000000000000000000000000000004", "rawScore": 20000, "rank": 3, "finalPoint": -10 },
          { "playerId": "player_00000000000000000000000000000001", "rawScore": 10000, "rank": 4, "finalPoint": -30 }
        ]
      },
      {
        "gameId": "R02-T02",
        "roundNumber": 2,
        "tableNumber": 2,
        "results": [
          { "playerId": "player_00000000000000000000000000000005", "rawScore": 35000, "rank": 1, "finalPoint": 25 },
          { "playerId": "player_00000000000000000000000000000006", "rawScore": 35000, "rank": 2, "finalPoint": 15 },
          { "playerId": "player_00000000000000000000000000000007", "rawScore": 20000, "rank": 3, "finalPoint": -5 },
          { "playerId": "player_00000000000000000000000000000008", "rawScore": 10000, "rank": 4, "finalPoint": -35 }
        ]
      }
    ],
    "officialResults": [
      { "playerId": "player_00000000000000000000000000000002", "point": 45, "rank": 1 },
      { "playerId": "player_00000000000000000000000000000004", "point": 30, "rank": 2 },
      { "playerId": "player_00000000000000000000000000000005", "point": 25, "rank": 3 },
      { "playerId": "player_00000000000000000000000000000001", "point": 0, "rank": 4 },
      { "playerId": "player_00000000000000000000000000000006", "point": 0, "rank": 4 },
      { "playerId": "player_00000000000000000000000000000003", "point": -5, "rank": 6 },
      { "playerId": "player_00000000000000000000000000000007", "point": -30, "rank": 7 }
    ]
  },
  "subgame": {
    "dataStatus": "sample",
    "scoring": {
      "ruleId": "stored-final-points",
      "ruleVersion": "1.0.0",
      "parameters": {}
    },
    "results": [
      { "roundNumber": 1, "playerId": "player_00000000000000000000000000000001", "point": 6 },
      { "roundNumber": 1, "playerId": "player_00000000000000000000000000000002", "point": 2 },
      { "roundNumber": 1, "playerId": "player_00000000000000000000000000000003", "point": -1 },
      { "roundNumber": 1, "playerId": "player_00000000000000000000000000000004", "point": 4 },
      { "roundNumber": 1, "playerId": "player_00000000000000000000000000000005", "point": -2 },
      { "roundNumber": 1, "playerId": "player_00000000000000000000000000000006", "point": 1 },
      { "roundNumber": 1, "playerId": "player_00000000000000000000000000000007", "point": -3 },
      { "roundNumber": 1, "playerId": "player_00000000000000000000000000000008", "point": -2 },
      { "roundNumber": 2, "playerId": "player_00000000000000000000000000000001", "point": -1 },
      { "roundNumber": 2, "playerId": "player_00000000000000000000000000000002", "point": 3 },
      { "roundNumber": 2, "playerId": "player_00000000000000000000000000000003", "point": 5 },
      { "roundNumber": 2, "playerId": "player_00000000000000000000000000000004", "point": 0 },
      { "roundNumber": 2, "playerId": "player_00000000000000000000000000000005", "point": 2 },
      { "roundNumber": 2, "playerId": "player_00000000000000000000000000000006", "point": -1 },
      { "roundNumber": 2, "playerId": "player_00000000000000000000000000000007", "point": -1 },
      { "roundNumber": 2, "playerId": "player_00000000000000000000000000000008", "point": -2 }
    ],
    "officialResults": [
      { "playerId": "player_00000000000000000000000000000001", "point": 5, "rank": 1 },
      { "playerId": "player_00000000000000000000000000000002", "point": 5, "rank": 1 },
      { "playerId": "player_00000000000000000000000000000003", "point": 4, "rank": 3 },
      { "playerId": "player_00000000000000000000000000000004", "point": 4, "rank": 3 },
      { "playerId": "player_00000000000000000000000000000005", "point": 0, "rank": 5 },
      { "playerId": "player_00000000000000000000000000000006", "point": 0, "rank": 5 },
      { "playerId": "player_00000000000000000000000000000007", "point": -4, "rank": 7 },
      { "playerId": "player_00000000000000000000000000000008", "point": -4, "rank": 7 }
    ]
  },
  "exportMetadata": {
    "generator": "jong-support-test-fixture",
    "source": "sample"
  }
}
